{
  "version": "0.2",

  "build_id": "B1",
  "milestone_id": "M1",
  "phase_id": null,
  "step_id": null,

  "pause_type": "decision",

  "last_action": {
    "action_id": "Human.InitializeProject",
    "result": "ok",
    "summary": "Initialized plans/ skeleton. Run Product.ProductVision to begin."
  },

  "next_action_id": "Product.ProductVision",

  "blockers": [],

  "context": {
    "goal": "<fill in: what are we building?>",
    "notes": [
      "STATE is the routing source of truth.",
      "STATUS must be updated every action.",
      "Thread is active working memory; prune regularly."
    ]
  }
}