{
  "$schema": "state.schema.json",
  "version": "0.2",

  "build_id": "B1",
  "milestone_id": "M2",
  "phase_id": "P2",
  "step_id": null,

  "pause_type": "continue",

  "last_action": {
    "action_id": "Staff.ImplementationExecution",
    "result": "ok",
    "summary": "P2 share URL encoding & hash routing implemented and committed. Routing to PM.StatusUpdate (code_review=every_milestone, not last phase)."
  },

  "next_action_id": "PM.StatusUpdate",

  "blockers": [],

  "context": {
    "goal": "Build a static, backend-free word search generator web app with create, print, share, and solve capabilities.",
    "notes": [
      "STATE is the routing source of truth.",
      "STATUS must be updated every action.",
      "Thread is active working memory; prune regularly."
    ]
  }
}